{
  "id": "11111111-1111-4111-8111-111111111111",
  "type": "audio",
  "title": "关于 AI 工作效率的随手语音",
  "status": "ready",
  "privacyLevel": "internal_reference",
  "isPersonalExperience": true,
  "language": "zh-CN",
  "normalizedText": "我发现使用 AI 后，执行时间减少了，但验证和返工时间增加了。",
  "sourceUrl": null,
  "tags": [
    "AI效率",
    "真实实验"
  ],
  "metadata": {
    "durationMs": 185000
  },
  "createdAt": "2026-07-12T10:00:00Z",
  "updatedAt": "2026-07-12T10:05:00Z"
}
